{
  "schemaVersion": 1,
  "payloadSha256": "059a367c332e5dc2cd581c8fdf9290cf89e8f937b5b2a3da516ff397f6d45f8a",
  "inventory": {
    "manifestSha256": "30dfbc3154494ae09eee32d1bcf005b627241051bb3531af3cb38e686dff1de7",
    "artifactSha256": "59bae155b45e791b1e1ec4f0003c4a3fa443c3d29bf91bb02ad931bfd797a2f7"
  },
  "scope": {
    "year": 2024,
    "territory": "catalunya",
    "unit": "EUR",
    "claim": "Candidato: baseInferior publicado, fila 8; coincidencia con identidad canónica exacta.",
    "conditions": [
      "Componente autonómico de la base liquidable general; residencia territorial debe acreditarse fuera de esta decisión.",
      "Aceptación limitada a la identidad y cuantía EUR de esta celda, en este ejercicio; no acepta mínimos, tipos como bindings, deducciones, redondeos ni liquidación completa.",
      "No autoriza registrar el payload original ni crear atestación; el padre debe preparar y revisar un payload nuevo con estas condiciones.",
      "Ámbito aceptado: cierre ordinario anual sin fallecimiento. Los supuestos de fallecimiento quedan fuera de esta decisión limitada."
    ],
    "completeRule": false
  },
  "decision": "accepted-limited",
  "reviewTaskId": "command:mcp:99a9fe10-4fb8-419d-8198-e5c0210805ae:delegate-task:irobopf-r19-sol-revision-bindings-autonomicos",
  "report": {
    "path": "docs/procedencia/revisiones/bindings-autonomicos-r19-sol/INFORME.md",
    "sha256": "21613cc34aa0944d1a0c372b665948939d412a1193016d6de182449004654e10"
  }
}
