{
  "schemaVersion": 1,
  "payloadSha256": "4d61e3052f44b27272873d25786be23351e58c195ad3f1c350c9594f01130b23",
  "inventory": {
    "manifestSha256": "30dfbc3154494ae09eee32d1bcf005b627241051bb3531af3cb38e686dff1de7",
    "artifactSha256": "59bae155b45e791b1e1ec4f0003c4a3fa443c3d29bf91bb02ad931bfd797a2f7"
  },
  "scope": {
    "year": 2012,
    "territory": "estatal-comun",
    "unit": "EUR",
    "claim": "Cuantía publicada ESTATAL_COMPLEMENTARIA_2012_2014, fila 0, columna cuota: 0 EUR.",
    "conditions": [
      "Aceptación limitada a cuantía nominal de esta celda y ejercicio, componente estatal de base general.",
      "No acepta base del ahorro, retenciones, componente autonómico, régimen foral ni declaración completa.",
      "La cuota tabulada es publicada: no sustituirla por integral de tipos.",
      "Elegibilidad, minoración por mínimos, anualidades, selección del caso y redondeo final quedan fuera."
    ],
    "completeRule": false
  },
  "decision": "accepted-limited",
  "reviewTaskId": "node:delegated-task:command%3Amcp%3A99a9fe10-4fb8-419d-8198-e5c0210805ae%3Adelegate-task%3Airobopf-r19-sol-revision-bindings-estatales",
  "report": {
    "path": "docs/procedencia/revisiones/bindings-estatales-r19-sol/INFORME.md",
    "sha256": "689742e84ec00d9000112cfdedae88d432e1c047c149ec5c823fc9f3a8d943f3"
  }
}
